Transaction date,Transaction,Name,Memo,Amount
10/24/2022,CREDIT,PREAUTHORIZED PAYMENT,,3519.8
10/20/2022,DEBIT,WESTWOOD TOTAL HEALTH COQUITLAM ,Rewards earned: 0.73 ~ Category: Other,-145
10/13/2022,DEBIT,COSTCO WHOLESALE W255 PORT COQUI,Rewards earned: 0.92 ~ Category: Other,-183.95
10/10/2022,DEBIT,SEWAK'S NO FRILLS STOR PORT COQU,Rewards earned: 0.70 ~ Category: Groceries,-35.24
10/8/2022,DEBIT,COSTCO WHOLESALE W51 BURNABY BC,Rewards earned: 0.44 ~ Category: Other,-88.41
10/5/2022,DEBIT,MIGRATIONSVERKE NORRKOPING SWE S,Rewards earned: 2.41 ~ Category: Other,-482.65
10/2/2022,DEBIT,CANADIAN FLIGHT CENTRE PITT MEAD,Rewards earned: 2.11 ~ Category: Other,-422.9
10/2/2022,DEBIT,LOCARNO BEACH CONCESSI VANCOUVER,Rewards earned: 0.02 ~ Category: Entertainment,-4.73
9/30/2022,DEBIT,CANADA GARDENWORKS COQUITLAM BC,Rewards earned: 0.27 ~ Category: Home Improvement,-53.17
